{
  "$schema": "http://json-schema.org/draft-07/schema#",
  "$id": "quality/schemas/coupling-report-v1.json",
  "title": "Coupling Report v1",
  "description": "Advisory coupling and stability report. Finding identities, trends, and package-level metrics with documented formulas.",
  "type": "object",
  "required": ["report_version", "total_modules", "flagged_count", "threshold", "findings"],
  "properties": {
    "report_version": {
      "const": "1",
      "description": "Schema version for forward compatibility."
    },
    "total_modules": {
      "type": "integer",
      "minimum": 0,
      "description": "Total number of modules analysed."
    },
    "flagged_count": {
      "type": "integer",
      "minimum": 0,
      "description": "Number of modules flagged as architecturally notable (D >= threshold)."
    },
    "flagged_identities": {
      "type": "array",
      "items": {"type": "string"},
      "description": "Sorted list of module names that are flagged."
    },
    "threshold": {
      "type": "number",
      "minimum": 0,
      "maximum": 1,
      "description": "Distance-from-main-sequence threshold used for flagging."
    },
    "graph_error": {
      "type": "boolean",
      "description": "True when a graph build error or parse error prevents analysis."
    },
    "trend": {
      "description": "Trend comparison against a previous snapshot (only present when --trend-compare is used).",
      "oneOf": [
        {
          "type": "object",
          "required": ["previous_flagged_count", "delta", "direction"],
          "properties": {
            "previous_flagged_count": {"type": "integer", "description": "Flagged count in the previous snapshot."},
            "delta": {"type": "integer", "description": "Net change in flagged count (current - previous)."},
            "direction": {
              "enum": ["improved", "regressed", "unchanged"],
              "description": "improved = fewer flagged, regressed = more flagged, unchanged = same count."
            },
            "previous_timestamp": {"type": "string", "description": "ISO-8601 timestamp from the previous report."},
            "added": {
              "type": "array",
              "items": {"type": "string"},
              "description": "Module identities that became flagged since the last snapshot."
            },
            "removed": {
              "type": "array",
              "items": {"type": "string"},
              "description": "Module identities that were resolved since the last snapshot."
            },
            "persistent": {
              "type": "array",
              "items": {"type": "string"},
              "description": "Module identities flagged in both the current and previous snapshots."
            }
          }
        },
        {"type": "null"}
      ]
    },
    "findings": {
      "type": "array",
      "description": "All module findings, sorted by distance descending.",
      "items": {"$ref": "#/definitions/finding"}
    },
    "timestamp": {
      "type": "string",
      "description": "ISO-8601 timestamp when this report was generated.",
      "format": "date-time"
    }
  },
  "definitions": {
    "finding": {
      "type": "object",
      "required": ["module", "ca", "ce", "instability", "abstractness", "distance", "advisory"],
      "properties": {
        "module": {
          "type": "string",
          "description": "Module name relative to root package (e.g. 'api.client')."
        },
        "ca": {
          "type": "integer",
          "minimum": 0,
          "description": "Afferent coupling: number of modules that depend on this module."
        },
        "ce": {
          "type": "integer",
          "minimum": 0,
          "description": "Efferent coupling: number of modules this module depends on."
        },
        "instability": {
          "type": "number",
          "minimum": 0,
          "maximum": 1,
          "description": "I = Ce / (Ca + Ce). 0 = max stability, 1 = max instability."
        },
        "abstractness": {
          "type": "number",
          "minimum": 0,
          "maximum": 1,
          "description": "A = abstract_classes / (abstract_classes + concrete_classes)."
        },
        "distance": {
          "type": "number",
          "minimum": 0,
          "maximum": 1,
          "description": "D = |A + I - 1|. Distance from the main sequence."
        },
        "zone_of_pain": {
          "type": "boolean",
          "description": "I < 0.3 and A < 0.3: stable, concrete, outgoing deps - rigid."
        },
        "zone_of_uselessness": {
          "type": "boolean",
          "description": "I > 0.7 and A > 0.7: unstable, abstract - no dependents."
        },
        "advisory": {
          "type": "boolean",
          "description": "Always true in v1. Findings are informational; graph/parse errors fail the command."
        },
        "finding_id": {
          "type": "string",
          "description": "Stable identifier: module name with hash suffix for deduplication across runs."
        },
        "dependencies": {
          "type": "array",
          "items": {"type": "string"},
          "description": "Module names that this module imports (efferent targets)."
        },
        "dependents": {
          "type": "array",
          "items": {"type": "string"},
          "description": "Module names that import this module (afferent sources)."
        }
      }
    }
  }
}
