{
  "report_version": "1",
  "total_modules": 97,
  "flagged_count": 34,
  "flagged_identities": [
    "api.endpoints",
    "api.models",
    "api.rest_client",
    "attachments",
    "auth.token_manager",
    "auth.utils",
    "commands._help_sections",
    "commands._runner_adapter",
    "envelope",
    "error_handler",
    "exit_codes",
    "formatting.context",
    "formatting.json",
    "formatting.markdown",
    "formatting.plain",
    "formatting.registry",
    "formatting.rich",
    "ports",
    "runners",
    "runners.config",
    "threads.cache_manager",
    "threads.scraper",
    "utils.config.contracts",
    "utils.encryption",
    "utils.file_permissions",
    "utils.http_errors",
    "utils.http_headers",
    "utils.logging",
    "utils.rate_limiter",
    "utils.retry",
    "utils.session_factory",
    "utils.session_token",
    "utils.style_manager",
    "utils.upstream_contracts"
  ],
  "threshold": 0.3,
  "graph_error": false,
  "trend": null,
  "findings": [
    {
      "module": "_types",
      "ca": 11,
      "ce": 0,
      "instability": 0.0,
      "abstractness": 0.0,
      "distance": 1.0,
      "zone_of_pain": true,
      "zone_of_uselessness": false,
      "advisory": true,
      "finding_id": "_types",
      "dependencies": [],
      "dependents": [
        "commands._runner_adapter",
        "envelope",
        "error_handler",
        "query_runner",
        "runners.auth",
        "runners.config",
        "runners.export",
        "runners.models",
        "runners.skill",
        "runners.status",
        "utils.http_errors"
      ]
    },
    {
      "module": "auth.models",
      "ca": 5,
      "ce": 0,
      "instability": 0.0,
      "abstractness": 0.0,
      "distance": 1.0,
      "zone_of_pain": true,
      "zone_of_uselessness": false,
      "advisory": true,
      "finding_id": "auth.models",
      "dependencies": [],
      "dependents": [
        "api.client",
        "api.endpoints",
        "api.rest_client",
        "query_runner",
        "runners.models"
      ]
    },
    {
      "module": "commands._help_refs",
      "ca": 5,
      "ce": 0,
      "instability": 0.0,
      "abstractness": 0.0,
      "distance": 1.0,
      "zone_of_pain": true,
      "zone_of_uselessness": false,
      "advisory": true,
      "finding_id": "commands._help_refs",
      "dependencies": [],
      "dependents": [
        "commands.auth_cmds",
        "commands.models_cmds",
        "commands.query_cmd",
        "commands.style_cmds",
        "commands.threads_cmds"
      ]
    },
    {
      "module": "commands._schemas",
      "ca": 1,
      "ce": 0,
      "instability": 0.0,
      "abstractness": 0.0,
      "distance": 1.0,
      "zone_of_pain": true,
      "zone_of_uselessness": false,
      "advisory": true,
      "finding_id": "commands._schemas",
      "dependencies": [],
      "dependents": [
        "commands.schema_cmd"
      ]
    },
    {
      "module": "completion_commands",
      "ca": 1,
      "ce": 0,
      "instability": 0.0,
      "abstractness": 0.0,
      "distance": 1.0,
      "zone_of_pain": true,
      "zone_of_uselessness": false,
      "advisory": true,
      "finding_id": "completion_commands",
      "dependencies": [],
      "dependents": [
        "commands"
      ]
    },
    {
      "module": "config.models",
      "ca": 5,
      "ce": 0,
      "instability": 0.0,
      "abstractness": 0.0,
      "distance": 1.0,
      "zone_of_pain": true,
      "zone_of_uselessness": false,
      "advisory": true,
      "finding_id": "config.models",
      "dependencies": [],
      "dependents": [
        "config",
        "runners.export",
        "runners.status",
        "utils.config.contracts",
        "utils.config.impl"
      ]
    },
    {
      "module": "help_json",
      "ca": 0,
      "ce": 0,
      "instability": 0.0,
      "abstractness": 0.0,
      "distance": 1.0,
      "zone_of_pain": true,
      "zone_of_uselessness": false,
      "advisory": true,
      "finding_id": "help_json",
      "dependencies": [],
      "dependents": []
    },
    {
      "module": "models",
      "ca": 0,
      "ce": 0,
      "instability": 0.0,
      "abstractness": 0.0,
      "distance": 1.0,
      "zone_of_pain": true,
      "zone_of_uselessness": false,
      "advisory": true,
      "finding_id": "models",
      "dependencies": [],
      "dependents": []
    },
    {
      "module": "models.model_config",
      "ca": 3,
      "ce": 0,
      "instability": 0.0,
      "abstractness": 0.0,
      "distance": 1.0,
      "zone_of_pain": true,
      "zone_of_uselessness": false,
      "advisory": true,
      "finding_id": "models.model_config",
      "dependencies": [],
      "dependents": [
        "ports",
        "runners.models",
        "services.model_service"
      ]
    },
    {
      "module": "ndjson",
      "ca": 1,
      "ce": 0,
      "instability": 0.0,
      "abstractness": 0.0,
      "distance": 1.0,
      "zone_of_pain": true,
      "zone_of_uselessness": false,
      "advisory": true,
      "finding_id": "ndjson",
      "dependencies": [],
      "dependents": [
        "query_streaming"
      ]
    },
    {
      "module": "runners._utils",
      "ca": 2,
      "ce": 0,
      "instability": 0.0,
      "abstractness": 0.0,
      "distance": 1.0,
      "zone_of_pain": true,
      "zone_of_uselessness": false,
      "advisory": true,
      "finding_id": "runners._utils",
      "dependencies": [],
      "dependents": [
        "runners.auth",
        "runners.skill"
      ]
    },
    {
      "module": "services",
      "ca": 0,
      "ce": 0,
      "instability": 0.0,
      "abstractness": 0.0,
      "distance": 1.0,
      "zone_of_pain": true,
      "zone_of_uselessness": false,
      "advisory": true,
      "finding_id": "services",
      "dependencies": [],
      "dependents": []
    },
    {
      "module": "session_log",
      "ca": 0,
      "ce": 0,
      "instability": 0.0,
      "abstractness": 0.0,
      "distance": 1.0,
      "zone_of_pain": true,
      "zone_of_uselessness": false,
      "advisory": true,
      "finding_id": "session_log",
      "dependencies": [],
      "dependents": []
    },
    {
      "module": "threads.date_parser",
      "ca": 1,
      "ce": 0,
      "instability": 0.0,
      "abstractness": 0.0,
      "distance": 1.0,
      "zone_of_pain": true,
      "zone_of_uselessness": false,
      "advisory": true,
      "finding_id": "threads.date_parser",
      "dependencies": [],
      "dependents": [
        "threads.scraper"
      ]
    },
    {
      "module": "threads.models",
      "ca": 1,
      "ce": 0,
      "instability": 0.0,
      "abstractness": 0.0,
      "distance": 1.0,
      "zone_of_pain": true,
      "zone_of_uselessness": false,
      "advisory": true,
      "finding_id": "threads.models",
      "dependencies": [],
      "dependents": [
        "threads.cache_manager"
      ]
    },
    {
      "module": "utils",
      "ca": 0,
      "ce": 0,
      "instability": 0.0,
      "abstractness": 0.0,
      "distance": 1.0,
      "zone_of_pain": true,
      "zone_of_uselessness": false,
      "advisory": true,
      "finding_id": "utils",
      "dependencies": [],
      "dependents": []
    },
    {
      "module": "utils.async_bridge",
      "ca": 3,
      "ce": 0,
      "instability": 0.0,
      "abstractness": 0.0,
      "distance": 1.0,
      "zone_of_pain": true,
      "zone_of_uselessness": false,
      "advisory": true,
      "finding_id": "utils.async_bridge",
      "dependencies": [],
      "dependents": [
        "auth.oauth_handler",
        "query_runner",
        "runners.export"
      ]
    },
    {
      "module": "utils.attachment_models",
      "ca": 5,
      "ce": 0,
      "instability": 0.0,
      "abstractness": 0.0,
      "distance": 1.0,
      "zone_of_pain": true,
      "zone_of_uselessness": false,
      "advisory": true,
      "finding_id": "utils.attachment_models",
      "dependencies": [],
      "dependents": [
        "api.models",
        "attachments.upload_manager",
        "ports",
        "query_runner",
        "utils.file_handler"
      ]
    },
    {
      "module": "utils.cookies",
      "ca": 4,
      "ce": 0,
      "instability": 0.0,
      "abstractness": 0.0,
      "distance": 1.0,
      "zone_of_pain": true,
      "zone_of_uselessness": false,
      "advisory": true,
      "finding_id": "utils.cookies",
      "dependencies": [],
      "dependents": [
        "api.client",
        "api.rest_client",
        "attachments.upload_manager",
        "threads.scraper"
      ]
    },
    {
      "module": "utils.exceptions",
      "ca": 27,
      "ce": 0,
      "instability": 0.0,
      "abstractness": 0.0,
      "distance": 1.0,
      "zone_of_pain": true,
      "zone_of_uselessness": false,
      "advisory": true,
      "finding_id": "utils.exceptions",
      "dependencies": [],
      "dependents": [
        "api.client",
        "api.endpoints",
        "attachments.upload_manager",
        "auth.oauth_handler",
        "auth.token_manager",
        "auth.utils",
        "error_handler",
        "exit_codes",
        "mcp_server",
        "query_runner",
        "query_streaming",
        "runners.auth",
        "runners.config",
        "runners.export",
        "runners.models",
        "runners.status",
        "threads.cache_manager",
        "threads.scraper",
        "threads.utils",
        "utils.config.impl",
        "utils.encryption",
        "utils.file_handler",
        "utils.file_permissions",
        "utils.http_errors",
        "utils.retry",
        "utils.session_token",
        "utils.upstream_contracts"
      ]
    },
    {
      "module": "utils.rate_limiter_models",
      "ca": 1,
      "ce": 0,
      "instability": 0.0,
      "abstractness": 0.0,
      "distance": 1.0,
      "zone_of_pain": true,
      "zone_of_uselessness": false,
      "advisory": true,
      "finding_id": "utils.rate_limiter_models",
      "dependencies": [],
      "dependents": [